{
  "$schema": "http://json-schema.org/draft-07/schema#",
  "$ref": "#/definitions/Ingredients",
  "definitions": {
    "Ingredients": {
      "type": "object",
      "properties": {
        "id": {
          "type": "string"
        },
        "name": {
          "type": "string"
        },
        "description": {
          "type": "string"
        },
        "processing": {
          "type": "array",
          "items": {
            "type": "object",
            "properties": {
              "id": {
                "type": "string"
              },
              "name": {
                "type": "string"
              },
              "amount": {
                "type": "number"
              }
            },
            "required": [
              "id",
              "name",
              "amount"
            ],
            "additionalProperties": false
          }
        },
        "recipes": {
          "type": "array",
          "items": {
            "type": "object",
            "properties": {
              "id": {
                "type": "string"
              },
              "name": {
                "type": "string"
              }
            },
            "required": [
              "id",
              "name"
            ],
            "additionalProperties": false
          }
        },
        "source": {
          "type": "array",
          "items": {
            "type": "string"
          }
        },
        "version": {
          "type": "string"
        }
      },
      "required": [
        "id",
        "name"
      ],
      "additionalProperties": false
    }
  }
}