{
  "id": "SpinelFruit",
  "name": "Spinel Fruit",
  "description": "The crystalline trees that grow widely in areas with Liquid Phlogiston produce these gem-shaped fruits after absorbing phlogiston.",
  "recipes": [
    {
      "id": "GlitteringGemstones",
      "name": "Glittering Gemstones"
    }
  ],
  "source": [
    "Found in Liquid Phlogiston Zones"
  ],
  "version": "5.0"
}