{
  "id": "GlabrousBeans",
  "name": "Kabuksuz Nohut",
  "description": "Teyvat'ta yaygın olan hafif aromalı bir baklagildir. Çeşitli şekillerde hazırlanabilir ve bu nedenle dünyanın her yerindeki insanlar tarafından geniş çapta kabul görmektedir.",
  "recipes": [
    {
      "id": "MintyBeanSoup",
      "name": "Minty Bean Soup"
    },
    {
      "id": "Panipuri",
      "name": "Panipuri"
    },
    {
      "id": "AaruMixedRice",
      "name": "Aaru Mixed Rice"
    },
    {
      "id": "Fatteh",
      "name": "Fatteh"
    },
    {
      "id": "Cassoulet",
      "name": "Cassoulet"
    },
    {
      "id": "MintyBeanSoup",
      "name": "Naneli Fasulye Çorbası"
    },
    {
      "id": "Panipuri",
      "name": "Panipuri"
    },
    {
      "id": "AaruMixedRice",
      "name": "Karışık Aaru Pilavı"
    },
    {
      "id": "Fatteh",
      "name": "Nohutlu Fette"
    },
    {
      "id": "Cassoulet",
      "name": "Güveç"
    },
    {
      "id": "FriedShrimpBeanballs",
      "name": "Kızarmış Karidesli Nohut Köftesi"
    },
    {
      "id": "BlazedMeatStew",
      "name": "Yakıcı Et Yahnisi"
    }
  ],
  "source": [
    "ซื้อจากร้านขายอาหารใน Sumeru",
    "ซื้อจากร้านขายของชำใน Fontaine",
    "Sumeru'daki restoranlarda satılır.",
    "Fontaine'deki gıda pazarında satılır.",
    "Natlan'daki gıda pazarında satılır."
  ],
  "version": "5.0"
}