{
	"id": "BambooShoot",
	"name": "Bamboo Shoot",
	"description": "หน่ออ่อนของต้นไผ่ที่งอกขึ้นมาใหม่ ๆ นั้นมีกลิ่นหอมมาก มีเพียงที่ ๆ ต้นไผ่เจริญเติบโตได้เท่านั้นจึงจะมีวัตถุดิบทำอาหารที่แสนอร่อยนี้",
	"recipes": [
		{
			"id": "Wakatakeni",
			"name": "Wakatakeni"
		},
		{
			"id": "BambooShootSoup",
			"name": "Bamboo Shoot Soup"
		},
		{
			"id": "TriplelayeredConsomm",
			"name": "Triple-Layered Consommé"
		},
		{
			"id": "RightAtHome",
			"name": "Right at Home"
		},
		{
			"id": "BraisedMeatball",
			"name": "Braised Meatballs"
		},
		{
			"id": "TonkotsuRamen",
			"name": "Tonkotsu Ramen"
		},
		{
			"id": "OncidiumTofu",
			"name": "Oncidium Tofu"
		}
	],
	"source": [
		"พบได้ในโลกกว้าง",
		"คำแนะนำ: หาได้ที่ป่าไผ่ Qingce Village"
	],
	"version": "4.4"
}